Key,Value
Collection_88_9,收容时需要口念天顺教教义中的《忏悔篇》，来显示自己的诚意。收容过程中不能沾到水，即可顺利完成收容。
Collection_89_6,两难打火机
Collection_89_7,被誉为受到利维坦诅咒的污染物，一度由军队和教堂分别保管，然而效果不佳。总有人受到诱惑一般去使用它而导致生命流逝。
Collection_89_8,一个高科技的打火机，每次使用必须要点三颗烟才能被熄灭。当第三颗烟被点燃，则第三个人就会被火焰吞噬；如果开始使用后迟迟不点第三颗烟，则使用者会被火焰吞噬。
Collection_89_9,收容该污染物并不困难，只要不让它处于使用状态就可以了。至于保管的空间，一定要确保是真空，无法点火的状态。
Collection_90_6,星期五日历
Collection_90_7,普通商店出售的日历，被这本日历搞疯的游行者恰好被杰克一行遇到。
Collection_90_8,一本神奇的日历。它会在人不注意的时候将当天日期改为星期五。
Collection_90_9,该污染物的污染程度非常低，按照正规的收容流程进行操作即可。
Collection_91_6,惩戒铁链
Collection_91_7,原本人们都认为被铁链责罚是这所教堂的特色，直到有一天神父自己也被打了。
Collection_91_8,一节存放在教堂内的锁链，一旦有人在教堂内忏悔自己的罪行，就会遭到这条锁链的毒打。
Collection_91_9,收容时，将铁链切割分为几段，分别进行收容，保证它们无法自行修复成完整的一条即可。
Collection_92_6,回魂圣水
Collection_92_7,纳卡地区常年战乱，人口失踪多半也会被怀疑流弹所致。直到有人在公开场合亲眼目睹了腐蚀的过程，才知道那些人失踪的真实原因。这远远超出了安保部队的处理能力范围，逼不得已，他们只能追求佣兵联盟的帮助。
Collection_92_8,深山中的一汪泉水，清澈见底，看似有限实则取之不尽。教会的人常常用它来给新生的婴儿做洗礼，也有成年人认为它可以洗去身上的罪行。被泉水洗过的人，会一心依附于一个虚无的神明。虚无的神是不能被质疑和诋毁的，否则就会让人全身溃烂而亡，最后化成一汪泉水，回到深山。
Collection_92_9,该收容物的污染程度非常高，且传染性极强。首先需要使用反模因装置进行长时间的信息对冲，降低其模因粒子纯度，然后使用特殊容器进行收容，存放在无光、真空的环境下。收容后也需要经常进行监控，确保其不会腐蚀掉容器，破坏收容。
